{
  "ref": "rec.01JB7Q.link_party.v1",
  "kind": "link_party",
  "record_ref": "0b7c6a2e-5d1f-4c1a-9a7e-2f4e9c1d8a01",
  "record_version": "7",
  "arguments": {
    "role": "sender",
    "party": {
      "name": "Ana María Rojas",
      "host_party_ref": "c1d2e3f4-a5b6-4c7d-8e9f-0a1b2c3d4e5f",
      "identifiers": [
        {
          "scheme": "national_id",
          "value": "52123456"
        }
      ]
    }
  },
  "evidence": [
    {
      "record_ref": "0b7c6a2e-5d1f-4c1a-9a7e-2f4e9c1d8a01",
      "attachment_ref": "6f1d2c3b-8a9e-4f70-b1c2-d3e4f5a6b7c8",
      "page": 1,
      "span": {
        "start": 412,
        "end": 497
      },
      "quote": "solicito copia del contrato de obra 045 de 2026 y de sus actas de supervisión",
      "source_version": "1"
    }
  ],
  "confidence": 0.97,
  "models": [
    "triage-small"
  ],
  "pipeline_fingerprint": "triage-2026.10.2+fc91d0",
  "supersedes": null,
  "run_ref": null,
  "rationale": null,
  "created_at": "2026-10-27T14:05:09Z",
  "expires_at": "2026-11-26T14:05:09Z"
}
